{
  "project_id": "example-project",
  "project_profile_revision": "example-project-profile-v2",
  "manifest_version": "1.0",
  "context_id": "CTX-DEMO",
  "context_revision": "demo-r1",
  "status": "ready",
  "sections": [
    { "kind": "facts", "artifact_ref": "context/sections/facts/facts-fixture-r1.json", "artifact_revision": "facts-fixture-r1", "artifact_sha256": "d1c7f9a79aa201c66f0797703beb641740f1563a4665709ac81123376995df0f" },
    { "kind": "prohibited_claims", "artifact_ref": "context/sections/prohibited-claims/prohibited-claims-fixture-r1.json", "artifact_revision": "prohibited-claims-fixture-r1", "artifact_sha256": "cc69c7cf2fcb5b43445ed339d0eeb0b211f7f5c8495b3bde6e222be2d230b454" },
    { "kind": "audience", "artifact_ref": "context/sections/audience/audience-fixture-r1.json", "artifact_revision": "audience-fixture-r1", "artifact_sha256": "453896dd31bca2b1d484281c365fc19a7e72c64b1e24808f9b6d8d868710706d" },
    { "kind": "market", "artifact_ref": "context/sections/market/market-fixture-r1.json", "artifact_revision": "market-fixture-r1", "artifact_sha256": "c54bfb7b990dedab9d010e1c9e62768758b08d03704ea7953100d23986ff314c" },
    { "kind": "funnel", "artifact_ref": "context/sections/funnel/funnel-fixture-r1.json", "artifact_revision": "funnel-fixture-r1", "artifact_sha256": "1952e3b1e0f4872bb0d98f497d29a75e89d5c2ab00b4547388db0ae13c2ae190" },
    { "kind": "metrics", "artifact_ref": "context/sections/metrics/metrics-fixture-r1.json", "artifact_revision": "metrics-fixture-r1", "artifact_sha256": "e0b401af7f0b5cdc829acd8c4c2de6a4ec26455015176dfe0151569112027f27" },
    { "kind": "channels", "artifact_ref": "context/sections/channels/channels-fixture-r1.json", "artifact_revision": "channels-fixture-r1", "artifact_sha256": "156c737a91d729737c179293f4d5557ce3a57f2f754a491e8cbea95be5318951" },
    { "kind": "authority", "artifact_ref": "context/sections/authority/authority-fixture-r1.json", "artifact_revision": "authority-fixture-r1", "artifact_sha256": "69858d83d97a11eae495165bcca867872e548033aaf5a431ebadd1fec2bcdaca" }
  ],
  "authority": {
    "autonomous_internal_work": true,
    "human_final_review_required": true,
    "publish_credentials_available": false
  },
  "created_at": "2026-09-01T00:09:52Z"
}
